{
  "certificate_type": "GENERIC_POLICY_AUDIT_CERTIFICATE",
  "policy_id": "generic-policy-authoring-policy",
  "policy_path": "docs/GENERIC_POLICY_AUTHORING_POLICY.md",
  "declared_scope": "GENERIC",
  "policy_sha256": "b196b84defe63f2fec35241974c8b1782d64520314fea75bc6d4b402e3def229",
  "audit_rules_id": "generic-policy-authoring-rules",
  "audit_rules_version": "1.0.0",
  "audit_result": "AUDITED_CLEAN",
  "findings": [{"finding_id": "GPA-001", "result": "REPAIRED", "reason": "Project storage paths needed an explicit non-generic boundary."}],
  "exceptions": [],
  "audited_at": "2026-09-07T10:25:21.2743024+09:00",
  "audit_method": "manual_static_generic_scope_audit_with_tracked_repair",
  "auditor": {"role": "development_agent", "id": "codex"},
  "git_revision": "4da564ee527f27c4cfd717cead62d3519fade693",
  "working_tree_state": {"dirty": true, "scope_note": "Certificate identifies the audited policy bytes by SHA-256; unrelated dirty changes are excluded."},
  "report_reference": "reports/policy_audits/generic_policy_baseline_audit_20260907.md",
  "provenance": {"pre_audit_sha256": "ed4bc32f533e2a810452e012bc53330020eb1b2335419676bd988767936c5f66", "repair_finding_ids": ["GPA-001"]}
}
